{
  "version": "smerc.access-token.v2",
  "session_id": "session_0123456789abcdef0123456789abcdef",
  "issuer": "smerc-pilot-api",
  "audience": "smerc-runtime-api",
  "tenant_id": "platform-team",
  "principal_id": "github-repo-1274598343",
  "scopes": ["actions.evaluate"],
  "source_legacy": false,
  "issued_at": 1783141200,
  "not_before": 1783141200,
  "expires_at": 1783141500,
  "workload_context": {
    "provider": "github_actions_oidc",
    "subject": "repo:KingsMtn/SMERC-Runtime-Permission-Layer:environment:production",
    "repository": "KingsMtn/SMERC-Runtime-Permission-Layer",
    "repository_id": "1274598343",
    "repository_owner_id": "293280548",
    "workflow_ref": "KingsMtn/SMERC-Runtime-Permission-Layer/.github/workflows/remote_example_workflow.yml@refs/heads/main",
    "workflow_sha": "88cd304cb0b7ac20cd4ea0742ef9915f6e83695b",
    "ref": "refs/heads/main",
    "commit_sha": "276b4ae3a30f9852644d7c7f5bf43833ba43f017",
    "run_id": "28709537757",
    "run_attempt": "1",
    "actor_id": "293280548",
    "event_name": "workflow_dispatch",
    "runner_environment": "github-hosted",
    "environment": "production",
    "token_id": "example-token-id-not-a-live-credential"
  }
}
